{
  "package_uid":"ep_synthetic_001",
  "subject_uid":"ohe_sicily_genesis",
  "claim_uids":["prometheus.runtime.evaluation_not_certification"],
  "place_context_version":"pc-v0.1",
  "system_boundary_version":"sb-v0.1",
  "observation_refs":["obs_sicily_001"],
  "method_refs":["method-soil-moisture-v0.1"],
  "raw_data_hashes":["aaaaaaaaaaaaaaaaaaaaaaaaaaaaaaaaaaaaaaaaaaaaaaaaaaaaaaaaaaaaaaaa"],
  "transformed_data_hashes":[],
  "claims_registry_hash":"bbbbbbbbbbbbbbbbbbbbbbbbbbbbbbbbbbbbbbbbbbbbbbbbbbbbbbbbbbbbbbbb",
  "missing_data_statement":"synthetic fixture; no missing observations",
  "adverse_event_statement":"synthetic fixture; no adverse event claim",
  "authoritative_for_mrv":false,
  "statement":"evaluation, not certification"
}
